identifier,description,Justification,Justification_clustered,Salutation,Closing,Self-reference,image,language,format,Script,Material,Business Type,Title,date,latitude,longitude,lat/long,spatial coverage,dcterms:creator,comment
20200621_084340.jpg,הכניסה מותרת בחבישת מסכה בלבד!!,,,,,,,Hebrew,hand written|printed,cursive,paper|pen,,"2020-06-21 - תל אביב - יפו, הצפון החדש - סביבת ככר המדינה",2020-06-21,32.0893843,34.7826084,32.08938429972223/34.7826084,"148, אבן גבירול, תל אביב - יפו, הצפון החדש - סביבת ככר המדינה, תל אביב-יפו, מחוז תל אביב, ישראל",Yael Netzer,
20200621_084409.jpg,הוראות כניסה לחנות: 1. חובה לחבוש מסכה! במידה ואין לך אתה חייב לרכוש כאן או שלא תוכל להיכנס. 2. יש לשמור מרחק של 2 מטר. 3. לא ניתן להיכנס יותר מ-2 אנשים בחנות. אנא שמרו מרחק! 4. יש לחטא ידיים בכניסה לחנות יש גל לחיטוי! תודה מראש על ההבנה צוות החנות,,,,תודה מראש על ההבנה צוות החנות,חנות,,Hebrew,printed,square,paper|printer,,"2020-06-21 - תל אביב - יפו, הצפון החדש - סביבת ככר המדינה",2020-06-21,32.0893843,34.7826084,32.08938429972223/34.7826084,"148, אבן גבירול, תל אביב - יפו, הצפון החדש - סביבת ככר המדינה, תל אביב-יפו, מחוז תל אביב, ישראל",Yael Netzer,
20200621_084429.jpg,לקוחות יקרות! אין להכנס לבוטיק ללא מסיכה ניתן להכנס עד 2 אנשים בבוטיק בברכה Kiki,,,לקוחות יקרות,בברכה <חתימה>,בוטיק|Kiki,,Hebrew,hand written,cursive,paper|pen,בגדים,"2020-06-21 - תל אביב - יפו, הצפון החדש - סביבת ככר המדינה",2020-06-21,32.0893843,34.7826084,32.08938429972223/34.7826084,"148, אבן גבירול, תל אביב - יפו, הצפון החדש - סביבת ככר המדינה, תל אביב-יפו, מחוז תל אביב, ישראל",Yael Netzer,
20200621_084443.jpg,אין כניסה ללא מסכה!,,,,,,,Hebrew,hand written,cursive,paper|marker pen,,"2020-06-21 - תל אביב - יפו, הצפון החדש - סביבת ככר המדינה",2020-06-21,32.0888113,34.7824899,32.0888113/34.7824899,"142, אבן גבירול, תל אביב - יפו, הצפון החדש - סביבת ככר המדינה, תל אביב-יפו, מחוז תל אביב, ישראל",Yael Netzer,
20200621_084504.jpg,בהתאם להנחיות מישרד הבריאות: * נא להיכנס אחד אחד - קונה אחד בכל פעם. * לשמור מרחק של 2 מטרים אחד מהשני. * חובה על עטיית מסיכה.,הנחיות מישרד הבריאות,הנחיות משרד הבריאות,,,,,Hebrew,printed,cursive,paper|marker pen,סדקית,"2020-06-21 - תל אביב - יפו, הצפון החדש - סביבת ככר המדינה",2020-06-21,32.0888113,34.7824899,32.0888113/34.7824899,"142, אבן גבירול, תל אביב - יפו, הצפון החדש - סביבת ככר המדינה, תל אביב-יפו, מחוז תל אביב, ישראל",Yael Netzer,
20200621_084527.jpg,לקהל לקחותינו- - על פי הנחיות משרד הבריאות - - יש להיכנס עם מסיכה! - ניתן לקבל את הקניה גם מחוץ לחנות! -ניתן להזמין טלפונית - איסוף עצמי/משלוח. - הגבלה ל-4 לקוחות. תודה על ההבנה! 054-5792778,הנחיות משרד הבריאות,הנחיות משרד הבריאות,לקהל לקחותינו,,,,Hebrew,printed|hand written,cursive,paper|marker pen,,"2020-06-21 - תל אביב - יפו, הצפון הישן - החלק הצפוני",2020-06-21,32.088546,34.7823702,32.088546/34.7823702,"129, אבן גבירול, תל אביב - יפו, הצפון הישן - החלק הצפוני, תל אביב-יפו, מחוז תל אביב, ישראל",Yael Netzer,
20200621_084548.jpg,הכניסה ללא מסיכה אסורה! שמרו על מרחק של שני מטר,,,,,,,Hebrew,printed,square,paper|printer,מסכות,"2020-06-21 - תל אביב - יפו, הצפון הישן - החלק הצפוני",2020-06-21,32.088546,34.7823702,32.088546/34.7823702,"129, אבן גבירול, תל אביב - יפו, הצפון הישן - החלק הצפוני, תל אביב-יפו, מחוז תל אביב, ישראל",Yael Netzer,
20200621_084615.jpg,"מאפיית לחמים לקוחות יקרים אנא, הקפידו לשמור על מרחק של 2 מטרים אחד מהשני. תודה על ההבנה, צוות מאפיית לחמים  הכניסה עם מסכות בלבד. 2 מ'",,,לקוחות יקרים,תודה על ההבנה|<חתימה>,,טבחים עם מסכות,Hebrew,printed,square,print,מאפיה,"2020-06-21 - הצפון הישן - החלק הצפוני, תל אביב-יפו",2020-06-21,32.088327,34.7822727,32.08832699972223/34.78227269972222,"שביל אבן גבירול, תל אביב - יפו, הצפון הישן - החלק הצפוני, תל אביב-יפו, מחוז תל אביב, ישראל",Yael Netzer,
20200621_084653.jpg,הכניסה לחנות במסכה!! ובדיקת חום!!,,,,,חנות,,Hebrew,hand written,cursive,paper|marker pen,,"2020-06-21 - תל אביב - יפו, הצפון הישן - החלק הצפוני",2020-06-21,32.0875669,34.7822045,32.087566899722226/34.78220449972222,"119, אבן גבירול, תל אביב - יפו, הצפון הישן - החלק הצפוני, תל אביב-יפו, מחוז תל אביב, ישראל",Yael Netzer,
20200621_084706.jpg,הכניסה עם מסכה בלבד!,,,,,,,Hebrew,hand written,cursive,paper|marker pen,,"2020-06-21 - תל אביב - יפו, הצפון הישן - החלק הצפוני",2020-06-21,32.0875669,34.7822045,32.087566899722226/34.78220449972222,"119, אבן גבירול, תל אביב - יפו, הצפון הישן - החלק הצפוני, תל אביב-יפו, מחוז תל אביב, ישראל",Yael Netzer,
20200621_084714.jpg,הכניסה/השירות יינתן בעת חבישת מסיכה בלבד!,,,,,,,Hebrew,printed,cursive,paper|marker pen,,"2020-06-21 - הצפון הישן - החלק הצפוני, תל אביב-יפו",2020-06-21,32.0878388,34.7821855,32.0878388/34.782185499722225,"שביל אבן גבירול, תל אביב - יפו, הצפון הישן - החלק הצפוני, תל אביב-יפו, מחוז תל אביב, ישראל",Yael Netzer,
20200621_084723.jpg,שלום ללקוחות קסרולה בבקשה להיכנס לחנות עם מסכה לפי הוראות משרד הבריאות,הוראות משרד הבריאות,הוראות משרד הבריאות,שלום ללקוחות,,קסרולה|חנות,,Hebrew,printed,square,paper|printer,,"2020-06-21 - הצפון הישן - החלק הצפוני, תל אביב-יפו",2020-06-21,32.0878388,34.7821855,32.0878388/34.782185499722225,"שביל אבן גבירול, תל אביב - יפו, הצפון הישן - החלק הצפוני, תל אביב-יפו, מחוז תל אביב, ישראל",Yael Netzer,
20200621_084746.jpg,אין כניסה ללא מסכה!,,,,,,,Hebrew,hand written,cursive,paper|marker pen,,"2020-06-21 - הצפון הישן - החלק הצפוני, תל אביב-יפו",2020-06-21,32.0878388,34.7821855,32.0878388/34.782185499722225,"שביל אבן גבירול, תל אביב - יפו, הצפון הישן - החלק הצפוני, תל אביב-יפו, מחוז תל אביב, ישראל",Yael Netzer,
20200621_084817.jpg,אסורה הכניסה ללא מסיכה,,,,,,,Hebrew,printed,square,paper|printer,,"2020-06-21 - הצפון הישן - החלק הצפוני, תל אביב-יפו",2020-06-21,32.0878388,34.7821855,32.0878388/34.782185499722225,"שביל אבן גבירול, תל אביב - יפו, הצפון הישן - החלק הצפוני, תל אביב-יפו, מחוז תל אביב, ישראל",Yael Netzer,
20200621_084825.jpg,אסורה כניסה ללא מסיכה! עד 2 לקוחות בו זמנית בתודה!,,,,,,,Hebrew,printed,square,paper|printer,,"2020-06-21 - הצפון הישן - החלק הצפוני, תל אביב-יפו",2020-06-21,32.0878388,34.7821855,32.0878388/34.782185499722225,"שביל אבן גבירול, תל אביב - יפו, הצפון הישן - החלק הצפוני, תל אביב-יפו, מחוז תל אביב, ישראל",Yael Netzer,
20200621_084840.jpg,"על פי הוראות משרד הבריאות - כניסה לחנות תתאפשר רק עם מסכת אף ופה בלבד, שמירה על היגיינת הידיים ומדידת חום - לא תתאפשר כניסה ללא מסכה - יש להיכנס ביחידים על פי סדר נא להישמע ולכבד את ההוראות תודה ובריאות טובה לכולם",הוראות משרד הבריאות,הוראות משרד הבריאות,,תודה ובריאות טובה לכולם,חנות,,Hebrew,printed,square,paper|printer,,"2020-06-21 - הצפון הישן - החלק הצפוני, תל אביב-יפו",2020-06-21,32.0878388,34.7821855,32.0878388/34.782185499722225,"שביל אבן גבירול, תל אביב - יפו, הצפון הישן - החלק הצפוני, תל אביב-יפו, מחוז תל אביב, ישראל",Yael Netzer,
20200621_084853.jpg,הנחיות התנהגות לציבור המבקרים בחנות 1. הכניסה לחנות מותנית בחבישת מסכה ומדידת חום. 2. הכניסה מותרת ל-2 לקוחות בלבד לכל קופה רושמת 3. חובה לשמור על מרחק של 2 מטרים בין לקוחות ובתור לקופה. 4. גם מחוץ לחנות יש לשמור על מרחק של 2  מטרים ולחבוש מסכה. 5. יש לשמור על כללי היגיינה לבטיחותם של כלל הלקוחות. נעבור את זה יחד!,,,ציבור המבקרים,נעבור את זה יחד!,חנות,,Hebrew,printed,square,paper|printer,,"2020-06-21 - הצפון הישן - החלק הצפוני, תל אביב-יפו",2020-06-21,32.0878388,34.7821855,32.0878388/34.782185499722225,"שביל אבן גבירול, תל אביב - יפו, הצפון הישן - החלק הצפוני, תל אביב-יפו, מחוז תל אביב, ישראל",Yael Netzer,
20200621_084922.jpg,כניסה רק עם מסכות ולא יותר משתי לקוחות תודה,,,,,,,Hebrew,hand written,cursive,paper|marker pen,,"2020-06-21 - הצפון הישן - החלק הצפוני, תל אביב-יפו",2020-06-21,32.0878388,34.7821855,32.0878388/34.782185499722225,"שביל אבן גבירול, תל אביב - יפו, הצפון הישן - החלק הצפוני, תל אביב-יפו, מחוז תל אביב, ישראל",Yael Netzer,
20200621_084931.jpg,לקוחות נכבדים בהתאם להנחיות משרד הבריאות נבקש שמירת הכללים: 1. הכניסה למכבסה מותנית בחבישת מסכה. 2. השימוש במכונות מותנה בשימוש בכפפות. 3. הכניסה מותרת ל-2 לקוחות בלבד. 4. נא הימנעו מהתקהלות. 5. נודה לכם על המתנה לסיום פעולת המכונה מחוץ למכבסה. 6. חובה לשמור על מרחק של 2 מטרים מאדם לאדם. 7. יש לשמור על כללי היגיינה לבטיחות של כלל הלקוחות.,הנחיות משרד הבריאות,הנחיות משרד הבריאות,לקוחות נכבדים,,מכבסה,,Hebrew,printed,square,paper|printer,,"2020-06-21 - הצפון הישן - החלק הצפוני, תל אביב-יפו",2020-06-21,32.0878388,34.7821855,32.0878388/34.782185499722225,"שביל אבן גבירול, תל אביב - יפו, הצפון הישן - החלק הצפוני, תל אביב-יפו, מחוז תל אביב, ישראל",Yael Netzer,
20200621_084939.jpg,הכניסה לחנות לאחר מדידת חום ועם מסיכה בלבד,,,,,חנות,,Hebrew,printed,square,paper|printer,,"2020-06-21 - הצפון הישן - החלק הצפוני, תל אביב-יפו",2020-06-21,32.0878388,34.7821855,32.0878388/34.782185499722225,"שביל אבן גבירול, תל אביב - יפו, הצפון הישן - החלק הצפוני, תל אביב-יפו, מחוז תל אביב, ישראל",Yael Netzer,
20200621_085051.jpg,אסורה הכניסה ללא מסיכה!!,,,,,,איש עם מסכה,Hebrew,printed,square,paper|printer,,"2020-06-21 - תל אביב - יפו, הצפון הישן - החלק הצפוני",2020-06-21,32.0865353,34.782003,32.0865353/34.782002999999996,"107, אבן גבירול, תל אביב - יפו, הצפון הישן - החלק הצפוני, תל אביב-יפו, מחוז תל אביב, ישראל",Yael Netzer,
20200621_174533.jpg,הכניסה אסורה ללא מסכה,,,,,,,Hebrew,printed,square,paper|printer,,"2020-06-21 - תל אביב - יפו, שפירא",2020-06-21,32.0538957,34.7775879,32.05389569972222/34.7775879,"90, מסילת ישרים, תל אביב - יפו, שפירא, תל אביב-יפו, מחוז תל אביב, ישראל",Yael Netzer,
20200621_174546.jpg,בהתאם להוראות משרד הבריאות אין להיכנס לחנות ללא מסכה,הוראות משרד הבריאות,הוראות משרד הבריאות,,,חנות,,Hebrew,printed,square,paper|printer,,"2020-06-21 - תל אביב - יפו, שפירא",2020-06-21,32.0538957,34.7775879,32.05389569972222/34.7775879,"90, מסילת ישרים, תל אביב - יפו, שפירא, תל אביב-יפו, מחוז תל אביב, ישראל",Yael Netzer,
20200623_173423.jpg,הכניסה לחנות אך ורק עם חבישת מסיכות,,,,,חנות,,Hebrew,printed,cursive,paper|pen,בגדים,"2020-06-23 - תל אביב - יפו, לב תל-אביב",2020-06-23,32.0671909,34.771488,32.06719089972223/34.77148799972222,"77, אלנבי, תל אביב - יפו, לב תל-אביב, תל אביב-יפו, מחוז תל אביב, ישראל",Yael Netzer,
20200623_173804.jpg,"בס""ד הכניסה לחנות עם מסכה בלבד!.",,,,,,,Hebrew,hand written,cursive,paper|marker pen,בגדים,"2020-06-23 - תל אביב - יפו, לב תל-אביב",2020-06-23,32.0680246,34.7709829,32.0680246/34.77098289972222,"78, אלנבי, תל אביב - יפו, לב תל-אביב, תל אביב-יפו, מחוז תל אביב, ישראל",Yael Netzer,
20200623_183546.jpg,עטיית מסכה בכניסה למקום חובה לעטות מסיכה,,,,,מקום,אישה עם מסכה,Hebrew,printed,square,paper|print,,"2020-06-23 - תל אביב - יפו, לב תל-אביב",2020-06-23,32.0624031,34.7751193,32.06240309972222/34.7751193,"12, מקוה ישראל, תל אביב - יפו, לב תל-אביב, תל אביב-יפו, מחוז תל אביב, ישראל",Yael Netzer,
20200623_183731.jpg,על פי הנחיות משרד הבריאות ולמען בטיחותכם ובטיחותנו כניסה למשרד עם מסכה בלבד. תודה,הנחיות משרד הבריאות| בטיחותכם|בטיחותנו,הנחיות משרד הבריאות| בטיחותכם|בטיחותנו,,תודה,משרד,,Hebrew,printed,square,paper|print,משרד?,"2020-06-23 - תל אביב - יפו, לב תל-אביב",2020-06-23,32.061592,34.7754283,32.06159199972222/34.7754283,"גינת השרון, ברזילי, תל אביב - יפו, לב תל-אביב, תל אביב-יפו, מחוז תל אביב, ישראל",Yael Netzer,
20200623_183744.jpg,- חובה לעטות מסכה בכניסה לחנות - נא לשמור מרחק של 2 מטר בין האנשים - נא לשמור מרחק של 2 מטר מהקופה - החנות מכילה עד שתי לקוחות + מוכרת שנהיה בריאים ותתחדשו! www.mayabash.com,,,,שנהיה בריאים ותתחדשו,חנות,<גרפי כלשהו>,Hebrew,printed,square,paper|print,בגדים,"2020-06-23 - תל אביב - יפו, לב תל-אביב",2020-06-23,32.061592,34.7754283,32.06159199972222/34.7754283,"גינת השרון, ברזילי, תל אביב - יפו, לב תל-אביב, תל אביב-יפו, מחוז תל אביב, ישראל",Yael Netzer,
20200626_085323.jpg,פליז כנסו עם מסכה :) אם אין לכם אנחנו נביא לכם 3>,,,פליז,,,"לב, חיוך",Hebrew,hand written,cursive,paper|marker pen,,"2020-06-26 - תל אביב - יפו, לב תל-אביב",2020-06-26,32.0681035,34.7690154,32.06810349972223/34.7690154,"5, רמב""ם, תל אביב - יפו, לב תל-אביב, תל אביב-יפו, מחוז תל אביב, ישראל",Yael Netzer,
20200626_094521.jpg,"מסכות, 2 מטר, 2 לקוחות, וכל הג'ז הזה",,,,,,3 לבבות,Hebrew,hand written,cursive,paper|marker pen,בגדי וינאג',"2020-06-26 - תל אביב - יפו, לב תל-אביב",2020-06-26,32.0679891,34.7692253,32.067989099722226/34.7692253,"7, רמב""ם, תל אביב - יפו, לב תל-אביב, תל אביב-יפו, מחוז תל אביב, ישראל",Yael Netzer,
20200626_103951.jpg,חובה להכנס עם מסכה,,,,,,,Hebrew,printed,cursive,paper|marker pen,חנות מקררים משומשים,"2020-06-26 - תל אביב - יפו, שפירא",2020-06-26,32.0588834,34.7774659,32.05888339972222/34.777465899999996,"10, הר ציון, תל אביב - יפו, שפירא, תל אביב-יפו, מחוז תל אביב, ישראל",Yael Netzer,
20200626_112215.jpg,"בס""ד הכניסה חייבת! במסכה  למען הבריאות הנלחמים בקורונה (מכבדי החוק.) תודה.",,,,הנלחמים בקורונה (מכבדי החוק)|תודה,,,Hebrew,hand written,cursive,paper|marker pen,,"2020-06-26 - תל אביב - יפו, נווה שאנן",2020-06-26,32.059159,34.7743294,32.059158999999994/34.77432939972222,"65, לוינסקי, תל אביב - יפו, נווה שאנן, תל אביב-יפו, מחוז תל אביב, ישראל",Yael Netzer,
20200626_112223.jpg,,,,,,,,,,,,,"2020-06-26 - תל אביב - יפו, נווה שאנן",2020-06-26,32.059159,34.7743294,32.059158999999994/34.77432939972222,"65, לוינסקי, תל אביב - יפו, נווה שאנן, תל אביב-יפו, מחוז תל אביב, ישראל",Yael Netzer,
20200626_114815.jpg,ללקחות היקרים אנא להצטייד במסיכות פנים לכניסה למסעדה בתודה,,,ללקוחות היקרים,בתודה,מסעדה,,Hebrew,hand written,cursive,paper|marker pen,,"2020-06-26 - שוק לוינסקי, פלורנטין",2020-06-26,32.0600468,34.7725147,32.060046799999995/34.7725147,"80, נחלת בנימין, שוק לוינסקי, פלורנטין, תל אביב-יפו, מחוז תל אביב, ישראל",Yael Netzer,
20200626_115548.jpg,הכניסה לחנות תותר רק עם מסיכה! (לא תתאפשר כניסה ללא מסיכה) הכניסה לחנות תתאפשר ל-5 אנשים במקביל! (השאר ימתינו בחוץ),,,,,חנות,,Hebrew,printed,square,paper|printer,,"2020-06-26 - תל אביב - יפו, פלורנטין",2020-06-26,32.0606639,34.7730798,32.060663899999994/34.77307979972222,"1, דה פיג'טו, תל אביב - יפו, פלורנטין, תל אביב-יפו, מחוז תל אביב, ישראל",Yael Netzer,
20200626_120126.jpg,הכניסה לחנות במסכה בלבד אנה הקפידו על כך בבקשה!!! תודה!!!,,,,תודה,חנות,,Hebrew,printed,square,paper|printer,,"2020-06-26 - תל אביב - יפו, פלורנטין",2020-06-26,32.0606202,34.7732012,32.060620199999995/34.7732012,"56, יפו, תל אביב - יפו, פלורנטין, תל אביב-יפו, מחוז תל אביב, ישראל",Yael Netzer,
20200628_145319.jpg,לקוחות ושליחים יקרים הכניסה רק עם כפפות ומסיכה ומוגבלת לשני אנשים דפוס נהרי,,,לקוחות ושליחים יקרים,,דפוס נהרי,,Hebrew,hand written|printed,square,paper|printer,סידקית,"2020-06-28 - תל אביב - יפו, נווה שאנן",2020-06-28,32.0607733,34.7738989,32.060773299999994/34.77389889972222,"123, אלנבי, תל אביב - יפו, נווה שאנן, תל אביב-יפו, מחוז תל אביב, ישראל",Yael Netzer,
20200628_164151.jpg,USE MASK,,,,,,מסכה,English,printed,square,paper|printer,,"2020-06-28 - תל אביב - יפו, נווה שאנן",2020-06-28,32.0587004,34.7771284,32.05870039972222/34.7771284,"41, י.ל. פרץ, תל אביב - יפו, נווה שאנן, תל אביב-יפו, מחוז תל אביב, ישראל",Yael Netzer,
20200628_165428.jpg,ATTENTION: No Face Mask No Enter! 2 mitter Distance and check Tep. Before Entering The Shop: Tr:Manegement,,,,,,,English,hand written,cursive,paper|marker pen,,"2020-06-28 - תל אביב - יפו, נווה שאנן",2020-06-28,32.0565534,34.781227,32.05655339972222/34.781227,"62, יסוד המעלה, תל אביב - יפו, נווה שאנן, תל אביב-יפו, מחוז תל אביב, ישראל",Yael Netzer,
20200628_175212.jpg,ברשותכם אין להכנס לבית המלאכה בלי מסכה,,,,,בית מלאכה,,Hebrew,hand written,cursive,paper|marker pen,כלובי ציפורים,"2020-06-28 - תל אביב - יפו, נווה שאנן",2020-06-28,32.0568959,34.7743634,32.0568959/34.77436339972222,"17, הקונגרס, תל אביב - יפו, נווה שאנן, תל אביב-יפו, מחוז תל אביב, ישראל",Yael Netzer,
20200630_180729.jpg,חובה חבישת מסיכה בכניסה לחנות.,,,ברשותכם,,,,Hebrew,printed,square,paper|printer,,"2020-06-30 - שוק לוינסקי, פלורנטין",2020-06-30,32.0596217,34.7732773,32.059621699999994/34.773277299722224,"13, החלוצים, שוק לוינסקי, פלורנטין, תל אביב-יפו, מחוז תל אביב, ישראל",Yael Netzer,
20200630_180852.jpg,"לקוחות יקרים! ע""פ הנחיות משרד הבריאות, יש להצטייד במסיכה ולשמור על היגיינה. תודה",הנחיות משרד הבריאות,הנחיות משרד הבריאות,לקוחות יקרים,תודה,,,Hebrew,hand written,cursive,paper|marker pen,מספרה,"2020-06-30 - שוק לוינסקי, פלורנטין",2020-06-30,32.0598386,34.7724689,32.05983859972222/34.77246889972222,"84, נחלת בנימין, שוק לוינסקי, פלורנטין, תל אביב-יפו, מחוז תל אביב, ישראל",Yael Netzer,
20200701_054240.jpg,"לקוחות יקרים! חלה חובת חבישת מסיכה פה ואף במרחב הציבורי בברכה, משתלת ברושים",,,לקוחות יקרים,,משתלת ברושים|מרחב ציבורי,,Hebrew,hand written,cursive,blackboard|marker pen,משתלה,"2020-07-01 - רמת שקמה, רמת גן",2020-07-01,32.044946,34.8136008,32.044945999999996/34.813600799999996,"הטייסים, תל אביב - יפו, רמת שקמה, רמת גן, מחוז תל אביב, ישראל",Yael Netzer,
20200702_074338.jpg,"ע""פ הנחיות משרד הבריות. חובה לעטות מסכה על הפנים בכניסה למשרד. תודה מוכתר סוכנות לביטוח.",הנחיות משרד הבריות,הנחיות משרד הבריאות,,,משרד|מוכתר סוכנות לביטוח,,Hebrew,hand written,cursive,paper|marker pen,סוכנות ביטוח,"2020-07-02 - תל אביב - יפו, עזרא והארגזים",2020-07-02,32.0477374,34.7944219,32.047737399999995/34.794421899999996,"57, לח""י, תל אביב - יפו, עזרא והארגזים, תל אביב-יפו, מחוז תל אביב, ישראל",Yael Netzer,
20200702_074440.jpg,"לפי הנחיות  משרד הבריאות תינתן הכניסה -לחנות עם מסכות בלבד!- ""יחד שומרים על החיים""  בתודה סופר הצומת.",הנחיות משרד הבריאות,הנחיות משרד הבריאות,,יחד שומרים על החיים|בתודה,חנות|סופר צמרת,לב,Hebrew,hand written,cursive,paper|marker pen,סופרמרקט,"2020-07-02 - תל אביב - יפו, התקוה",2020-07-02,32.0477923,34.7940199,32.04779229972222/34.794019899999995,"99, אצ""ל, תל אביב - יפו, התקוה, תל אביב-יפו, מחוז תל אביב, ישראל",Yael Netzer,
20200703_073655.jpg,אל תכנסו בלי המסכה,,,,,,,Hebrew|Amharic,printed,square,paper|printer,,"2020-07-03 - תל אביב - יפו, נווה שאנן",2020-07-03,32.0568275,34.7796845,32.05682749972222/34.7796845,"105, לוינסקי, תל אביב - יפו, נווה שאנן, תל אביב-יפו, מחוז תל אביב, ישראל",Yael Netzer,
20200703_074046.jpg,לקוחות יקרים אין להיכנס לחנות ללא מסכה לפי הוראת פיקוד העורף תודה,הוראות פיקוד העורף,הוראות פיקוד העורף,,תודה,חנות,,Hebrew,printed,square,paper|printer,,"2020-07-03 - תל אביב - יפו, נווה שאנן",2020-07-03,32.0557367,34.782259,32.05573669972222/34.782258999999996,"127, לוינסקי, תל אביב - יפו, נווה שאנן, תל אביב-יפו, מחוז תל אביב, ישראל",Yael Netzer,
20200703_074108.jpg,לפי הנחיות משרד הבראות הכניסה עם מסכה בלבד!!!,הנחיות משרד הבראות,הנחיות משרד הבריאות,,,,,Hebrew,hand written,cursive,paper|marker pen,,"2020-07-03 - תל אביב - יפו, נווה שאנן",2020-07-03,32.0564324,34.7813364,32.05643239972222/34.7813364,"61, יסוד המעלה, תל אביב - יפו, נווה שאנן, תל אביב-יפו, מחוז תל אביב, ישראל",Yael Netzer,
