identifier,description,Justification,Justification_clustered,Salutation,Closing,Self-reference,image,language,format,Script,Material,Business Type,Title,date,latitude,longitude,lat/long,spatial coverage,dcterms:creator,comment
20200726_194255.jpg,לקוחות יקרים החנות פתוחה ללקוחות בהתאם להוראות משרד הבריאות  חובת מסיכה מותרת כניסה ל5 לקוחות שמירה על מרחק 2 מטר בחנות ובתור מדידת חום <boutique cental לוגו>,הוראות משרד הבריאות,הוראות משרד הבריאות,לקוחות יקרים,,חנות,מסכה|שני אנשים|מרחק|מדחום,Hebrew,printed,square,print,מעדניה,"2020-07-26 - תל אביב - יפו, הצפון החדש - סביבת ככר המדינה",2020-07-26,32.0871132,34.7882521,32.087113199722225/34.7882521,"119, ז'בוטינסקי, תל אביב - יפו, הצפון החדש - סביבת ככר המדינה, תל אביב-יפו, מחוז תל אביב, ישראל",Yael Netzer,
20200726_194336.jpg,"לקהל לקוחות וימיה, להלן הנחיות התו הסגול: הצהרת בריאות ומדידת חום לנכנסים. לא תותר כניסת עובד עם חום גוף העולה על 38 מעלות צלזיוס.  חובה לעטות מסיכת פה  הגבלה של מספר הנכנסים לחנות כך שלא יהיו יותר מ-2 לקוחות בו זמנית בחנות.  תודה על ההבנה ובריאות לכולנו  צוות וימיה",הנחיות התו הסגול,הנחיות התו הסגול,לקהל לקוחות וימיה,תודה על ההבנה|בריאות לכולנו|<חתימה>,חנות,,Hebrew,printed,square,paper|printer,ביגוד,"2020-07-26 - תל אביב - יפו, הצפון החדש - סביבת ככר המדינה",2020-07-26,32.086931,34.7881762,32.08693099972223/34.788176199999995,"120, ז'בוטינסקי, תל אביב - יפו, הצפון החדש - סביבת ככר המדינה, תל אביב-יפו, מחוז תל אביב, ישראל",Yael Netzer,
20200726_194408.jpg,"בס""ד <לוגו שעון> נא לחבוש מסכה תודה",,,,תודה,,,Hebrew,hand written,square,paper|marker pen,שעונים,"2020-07-26 - תל אביב - יפו, הצפון החדש - סביבת ככר המדינה",2020-07-26,32.086931,34.7881762,32.08693099972223/34.788176199999995,"120, ז'בוטינסקי, תל אביב - יפו, הצפון החדש - סביבת ככר המדינה, תל אביב-יפו, מחוז תל אביב, ישראל",Yael Netzer,
20200726_194445.jpg,נא לא להיכנס בלי מסכות. נא לא להיכנס יותר מי בן אדם אחד. יש לבדוק חום לפני הכניסה.  veuillez ne pas rentrer sans  masque. veuillez ne pas rentrer a plus d'une personne. La temperature doit etre verifiee a l'entree de la boutique  תודה רבה merci cordialement,,,,תודה רבה|merci cordialement,,,Hebrew|French,printed,square,paper|printer,ביגוד,"2020-07-26 - תל אביב - יפו, הצפון החדש - סביבת ככר המדינה",2020-07-26,32.086931,34.7881762,32.08693099972223/34.788176199999995,"120, ז'בוטינסקי, תל אביב - יפו, הצפון החדש - סביבת ככר המדינה, תל אביב-יפו, מחוז תל אביב, ישראל",Yael Netzer,
20200726_194510.jpg,<לוגו> נא לא להיכנס בלי מסכות. נא לא להיכנס יותר מי בן אדם אחד. יש לבדוק חום לפני הכניסה.  veuillez ne pas rentrer sans  masque. veuillez ne pas rentrer a plus d'une personne. La temperature doit etre verifiee a l'entree de la boutique  תודה רבה merci cordialement,,,,תודה רבה|merci cordialement,,,Hebrew|French,printed,square,paper|printer,ביגוד,"2020-07-26 - תל אביב - יפו, הצפון החדש - סביבת ככר המדינה",2020-07-26,32.086931,34.7881762,32.08693099972223/34.788176199999995,"120, ז'בוטינסקי, תל אביב - יפו, הצפון החדש - סביבת ככר המדינה, תל אביב-יפו, מחוז תל אביב, ישראל",Yael Netzer,
20200726_194527.jpg,נא לא להיכנס בלי מסכות. נא לא להיכנס יותר מי בן אדם אחד. יש לבדוק חום לפני הכניסה.  veuillez ne pas rentrer sans  masque. veuillez ne pas rentrer a plus d'une personne. La temperature doit etre verifiee a l'entree de la boutique  תודה רבה merci cordialement,,,,תודה רבה|merci cordialement,,,Hebrew|French,printed,square,paper|printer,נעליים,"2020-07-26 - תל אביב - יפו, הצפון החדש - סביבת ככר המדינה",2020-07-26,32.086931,34.7881762,32.08693099972223/34.788176199999995,"120, ז'בוטינסקי, תל אביב - יפו, הצפון החדש - סביבת ככר המדינה, תל אביב-יפו, מחוז תל אביב, ישראל",Yael Netzer,
20200726_194545.jpg,תקנות עסק לשעת חירום נגיף קורונה: 1. הכניסה מותרת ל-2 תקוחות במקביל בלבד. 2. על הלקוחות לחבוש מסכה וללבוש כפפות. 3. על הלקוחות לשמור על מרחק 2 מטר. 4. יש לבצע מדידת חום בכניסה לחנות. תודה על שיתוף הפעולה,תקנות עסק לשעת חירום נגיף קורונה,תקנות עסק לשעת חירום נגיף קורונה,,תודה על שיתוף הפעולה,חנות,,Hebrew,printed,square,paper|printer,פרחים,"2020-07-26 - תל אביב - יפו, הצפון החדש - סביבת ככר המדינה",2020-07-26,32.0865122,34.788241,32.0865122/34.78824099972222,"6, ה' באייר, תל אביב - יפו, הצפון החדש - סביבת ככר המדינה, תל אביב-יפו, מחוז תל אביב, ישראל",Yael Netzer,
20200726_194556.jpg,לקוחות יקרים בהתאם להנחיות משרד הבריאות  כל לקוח חייב לעטות מסיכה המכסה את האף והפה הכניסה מותנית בבדיקת חום השהייה בחנות מוגבלת לשני לקוחות לכל היותר באותה עת אנא הקפידו לשמור מרחק של 2 מטרים האחד מהשני תודה על שיתוף הפעולה וההבנה,הנחיות משרד הבריאות,הנחיות משרד הבריאות,לקוחות יקרים,תודה על שיתוף הפעולה וההבנה,חנות,,Hebrew,printed,square,paper|printer,נעליים,"2020-07-26 - תל אביב - יפו, הצפון החדש - סביבת ככר המדינה",2020-07-26,32.0865122,34.788241,32.0865122/34.78824099972222,"6, ה' באייר, תל אביב - יפו, הצפון החדש - סביבת ככר המדינה, תל אביב-יפו, מחוז תל אביב, ישראל",Yael Netzer,
20200726_194618.jpg,הכניסה לחנות במסכה בלבד  <לוגו>,,,,,חנות,צילום אישה עם מסכה|לוגו,Hebrew,printed,square,paper|printer,נעליים,"2020-07-26 - תל אביב - יפו, הצפון החדש - סביבת ככר המדינה",2020-07-26,32.0865122,34.788241,32.0865122/34.78824099972222,"6, ה' באייר, תל אביב - יפו, הצפון החדש - סביבת ככר המדינה, תל אביב-יפו, מחוז תל אביב, ישראל",Yael Netzer,
20200726_194636.jpg,"לקוחות יקרים בהתאם להוראות משרד הבריאות נבקשכם לשמור מרחק של 2 מטר בין אדם לאדם ולשים מסכה בכל עת תודה על שיתוף הפעולה  DEAR CLIENTS In accordance with the instructions of the  MInistry of Health, we kindly ask you to keep a distance of 2 meters from each other, and wear a face mask at all times  Thank you for your cooperation",הוראות משרד הבריאות,הוראות משרד הבריאות,לקוחות יקרים,תודה על שיתוף הפעולה,,,Hebrew|English,printed,square,,,"2020-07-26 - תל אביב - יפו, הצפון החדש - סביבת ככר המדינה",2020-07-26,32.0865122,34.788241,32.0865122/34.78824099972222,"6, ה' באייר, תל אביב - יפו, הצפון החדש - סביבת ככר המדינה, תל אביב-יפו, מחוז תל אביב, ישראל",Yael Netzer,
20200726_194651.jpg,"לקוחות יקרים, על פי הנחיות משרד הבריאות, בכניסה לחנות חובה לעטות מסיכה, לשמור מרחק כ2 מ' בין השוהים בחנות, שמרו על הגיינת ידיים תודה צוות ANIK",הנחיות משרד הבריאות,הנחיות משרד הבריאות,לקוחות יקרים,תודה|<חתימה>,חנות,,Hebrew,printed,square,paper|printer,ביגוד,"2020-07-26 - תל אביב - יפו, הצפון החדש - סביבת ככר המדינה",2020-07-26,32.0865122,34.788241,32.0865122/34.78824099972222,"6, ה' באייר, תל אביב - יפו, הצפון החדש - סביבת ככר המדינה, תל אביב-יפו, מחוז תל אביב, ישראל",Yael Netzer,
20200726_194710.jpg,"לקוחות יקרים, בעקבות הנחיות משרד הבריאות, אנא הקפידו לשמור על מרחק של שני מטרים לפחות האחד מהשני.  תודה על שיתוף הפעולה L'OCCITANE EN PROVENCE",הנחיות משרד הבריאות,הנחיות משרד הבריאות,לקוחות יקרים,תודה על שיתוף הפעולה|<חתימה>,,,Hebrew,printed,square,print,תמרוקים,"2020-07-26 - תל אביב - יפו, הצפון החדש - סביבת ככר המדינה",2020-07-26,32.0865122,34.788241,32.0865122/34.78824099972222,"6, ה' באייר, תל אביב - יפו, הצפון החדש - סביבת ככר המדינה, תל אביב-יפו, מחוז תל אביב, ישראל",Yael Netzer,
20200726_194721.jpg,הכניסה עם מסיכה תודה,,,,,,,Hebrew,hand written,cursive,paper|marker pen,נעליים,"2020-07-26 - תל אביב - יפו, הצפון החדש - סביבת ככר המדינה",2020-07-26,32.0865122,34.788241,32.0865122/34.78824099972222,"6, ה' באייר, תל אביב - יפו, הצפון החדש - סביבת ככר המדינה, תל אביב-יפו, מחוז תל אביב, ישראל",Yael Netzer,
20200726_194739.jpg,הכניסה עם חבישת מסיכה בלבד! יש לשמור על מרחק של 2 מטר,,,,,,,Hebrew,hand written,square,paper|marker pen,ממתקים,"2020-07-26 - תל אביב - יפו, הצפון החדש - סביבת ככר המדינה",2020-07-26,32.0865509,34.7883494,32.086550899722226/34.7883494,"6, ה' באייר, תל אביב - יפו, הצפון החדש - סביבת ככר המדינה, תל אביב-יפו, מחוז תל אביב, ישראל",Yael Netzer,
20200726_194821.jpg,לקוחות יקרים! חנותנו מחזיקה בתו סגול. כך שבקורכם בטוח ואנו משתמשים במיטב האמצעים להגנתכם והגנת עובדנו 1. מדידת חום 2. חובה לחבוש מסיכת פה ואף לרווחת הלקוחות תוצב עמדה לחיטוי ידיים ליד קופה. בברכה ... הנהלת TUT Danz,תו סגול,תו סגול,לקוחות יקרים,בברכה|<חתימה>,חנות,,Hebrew,hand written,cursive,paper|marker pen,ביגוד,"2020-07-26 - תל אביב - יפו, הצפון החדש - סביבת ככר המדינה",2020-07-26,32.0860958,34.7884602,32.0860958/34.788460199999996,"10, תש״ח, תל אביב - יפו, הצפון החדש - סביבת ככר המדינה, תל אביב-יפו, מחוז תל אביב, ישראל",Yael Netzer,
20200726_200030.jpg,לקוחות יקרים! ניתן להזמין TA! * אנו רשאים להכניס למקום עד שני אנשים במקביל ובתנאי שמקפידים על מרחק של 2 מטר אחד מהשני.  צודה על ההבנה. בריאות ובתאבון!  צוות ג'וזף.,,,לקוחות יקרים,תודה על ההבנה|בריאות ובתאבון|<חתימה>,מקום,,Hebrew,printed,square,paper|printer,מזון,"2020-07-26 - תל אביב - יפו, הצפון הישן - החלק הדרומי",2020-07-26,32.0794148,34.7809671,32.0794148/34.78096709972222,"Kube Bar, מלכי ישראל, תל אביב - יפו, הצפון הישן - החלק הדרומי, תל אביב-יפו, מחוז תל אביב, ישראל",Yael Netzer,
20200726_201032.jpg,הכניסה עם מסיכות,,,,,,,Hebrew,printed,square,paper|printer,המבורגר,"2020-07-26 - תל אביב - יפו, גני שרונה",2020-07-26,32.0697721,34.7828538,32.0697721/34.78285379972222,"12, קרליבך, תל אביב - יפו, גני שרונה, תל אביב-יפו, מחוז תל אביב, ישראל",Yael Netzer,
20200726_204613.jpg,הכניסה עם מסיכה בלבד  3> NATURE BOYS | PUT --> Your MASK ON!,,,,,,,Hebrew|English,hand written,cursive,paper|marker pen,מסעדה,"2020-07-26 - הרכבת, תל אביב - יפו",2020-07-26,32.0634189,34.776606,32.063418899999995/34.776606,"פיס אוף קייק, 30, הרכבת, תל אביב - יפו, לב תל-אביב, תל אביב-יפו, מחוז תל אביב, 6511609, ישראל",Yael Netzer,
20200727_190914.jpg,בהוראת משרד הבריאות אסור להיכנס ללא מסכות עים כיסוי לפנים. אסור להיכנס יותר מ-2 לקוחות לחנות. נא להישמע להוראות תודה | <אמהרית> | PLease USe Mask,הוראת משרד הבריאות,הוראות משרד הבריאות,,תודה,,,Hebrew|Amharic|English,hand written,cursive,paper|marker pen,"מכולת, פיצוחים","2020-07-27 - תל אביב - יפו, שפירא",2020-07-27,32.05915,34.7781,32.05915/34.7781,"5, הר ציון, תל אביב - יפו, שפירא, תל אביב-יפו, מחוז תל אביב, ישראל",Yael Netzer,
20200727_190925.jpg,<אמהרית> you have to use mask,,,,,,שני אנשים עם מסכות,Amharic|English,printed,square,paper|printer,בגדים,"2020-07-27 - תל אביב - יפו, שפירא",2020-07-27,32.05915,34.7781,32.05915/34.7781,"5, הר ציון, תל אביב - יפו, שפירא, תל אביב-יפו, מחוז תל אביב, ישראל",Yael Netzer,
20200727_190944.jpg,לקהל לקוחותינו אין כניסה לחנות ללא מסיכה תודה,,,קהל לקוחותינו,תודה,חנות,,Hebrew,hand written,cursive,paper|marker pen,בגדים,"2020-07-27 - תל אביב - יפו, שפירא",2020-07-27,32.05919,34.77814,32.05919/34.77814,"3, הר ציון, תל אביב - יפו, שפירא, תל אביב-יפו, מחוז תל אביב, ישראל",Yael Netzer,
20200727_191010.jpg,please do not enter without a mask בבקשה אל תכנסו ללא מסכה,,,,,,איש בלי מסכה וי ירוק|איש בלי מסכה איקס אדום,English|Hebrew,printed,square,paper|printer|nylon,מכולת|סלולר,"2020-07-27 - נווה שאנן, תל אביב-יפו",2020-07-27,32.05929,34.77811,32.05929/34.77811,"שדרות הר ציון, תל אביב - יפו, נווה שאנן, תל אביב-יפו, מחוז תל אביב, ישראל",Yael Netzer,
20200727_191032.jpg,DEAR CUSTOMER <אמהרית> * Please fiollow the health and safety regulations. * Wear mask all the times. * Keep 2 meters apart. * Please wait for the customer inside  to leave and only then enter.,health and safety regulations,health and safety regulations,dear customer,,,מסכה,English|Amharic,printed,square,paper|printer,תמרוקים,"2020-07-27 - נווה שאנן, תל אביב-יפו",2020-07-27,32.05929,34.77811,32.05929/34.77811,"שדרות הר ציון, תל אביב - יפו, נווה שאנן, תל אביב-יפו, מחוז תל אביב, ישראל",Yael Netzer,
20200727_191131.jpg,USE MASK <אמהרית> | בבקשה לפני כניסה USE לעסק לשים מסכה MASK <אמהרית> בבקשה לפני כניסה <אמהרית> לעסק לשים מסכה,,,,,עסק,מסכה,English|Amharic|Hebrew,printed|hand written,square,paper|printer|marker pen,סלולר וחשמל,"2020-07-27 - תל אביב - יפו, נווה שאנן",2020-07-27,32.05936,34.77881,32.05936/34.77881,"3, נווה שאנן, תל אביב - יפו, נווה שאנן, תל אביב-יפו, מחוז תל אביב, ישראל",Yael Netzer,
20200727_191141.jpg,WEAR A MASK PLEASE!! <ערבית>  חבוש מסיכה בבקשה,,,,,,4 שלבים חבישת מסכה,English|Arabic|Hebrew,printed,square,paper|printer,סדקית,"2020-07-27 - תל אביב - יפו, נווה שאנן",2020-07-27,32.05936,34.77881,32.05936/34.77881,"3, נווה שאנן, תל אביב - יפו, נווה שאנן, תל אביב-יפו, מחוז תל אביב, ישראל",Yael Netzer,
20200727_191150.jpg,<אמהרית> USE MASK!!  השתמש במסכה,,,,,,מסכה,Amharic|English|Hebrew,printed,square,paper|printer,כלי בית,"2020-07-27 - תל אביב - יפו, נווה שאנן",2020-07-27,32.05936,34.77881,32.05936/34.77881,"3, נווה שאנן, תל אביב - יפו, נווה שאנן, תל אביב-יפו, מחוז תל אביב, ישראל",Yael Netzer,
20200727_191231.jpg,אל תכנסו בלי לחבוש מסכה בבקשה! Do not enter without wearing a mask please,,,,,,צילום מסכה ושתי ידיים עם כפפות,Hebrew|English,printed,square,paper|printer,מוצרי חשמל|סלולר,"2020-07-27 - תל אביב - יפו, נווה שאנן",2020-07-27,32.05936,34.77881,32.05936/34.77881,"3, נווה שאנן, תל אביב - יפו, נווה שאנן, תל אביב-יפו, מחוז תל אביב, ישראל",Yael Netzer,
20200727_191346.jpg,<אמהרית> USE MASK  השתמש במסכה,,,,,,מסכה,Amharic|English|Hebrew,printed,square,paper|printer,מסעדה,"2020-07-27 - תל אביב - יפו, נווה שאנן",2020-07-27,32.05903,34.77932,32.05903/34.77932,"16, נווה שאנן, תל אביב - יפו, נווה שאנן, תל אביב-יפו, מחוז תל אביב, ישראל",Yael Netzer,
20200727_191457.jpg,אין כניסה לחנות ללא מסיכה,,,,,חנות,,Hebrew,hand written,cursive|square,cardboard|marker pen,כלי בית וחשמל,"2020-07-27 - תל אביב - יפו, נווה שאנן",2020-07-27,32.05878,34.77981,32.05878/34.77981,"19, נווה שאנן, תל אביב - יפו, נווה שאנן, תל אביב-יפו, מחוז תל אביב, ישראל",Yael Netzer,
20200727_191515.jpg,<NO TEXT>,,,,,,פרצוף אסיאתי עם מסכה|פרצוף לא אסיתי בלי מסכה עם ביטול,,,,paper|printer,סדקית כלי בית,"2020-07-27 - תל אביב - יפו, נווה שאנן",2020-07-27,32.05878,34.77981,32.05878/34.77981,"19, נווה שאנן, תל אביב - יפו, נווה שאנן, תל אביב-יפו, מחוז תל אביב, ישראל",Yael Netzer,
20200727_191627.jpg,לקוח נכבד לא תתאפשר כניסה ללא מסכה  אנא שמור מרחק של שני מטר מהלקוח אשר לפניך אנא עמוד לפי הסימון בחנות  תודה <כתב יד לא ברור>,,,לקוח נכבד,תודה,חנות,,Hebrew,printed,square,paper|printer|marker pen,מזון,"2020-07-27 - תל אביב - יפו, נווה שאנן",2020-07-27,32.0583,34.78011,32.0583/34.78011,"27, נווה שאנן, תל אביב - יפו, נווה שאנן, תל אביב-יפו, מחוז תל אביב, ישראל",Yael Netzer,
20200727_191801.jpg,WEAR A MASK PLEASE!! <ערבית>  חבוש מסיכה בבקשה,,,,,,4 שלבים חבישת מסכה,English|Arabic|Hebrew,printed,square,paper|printer,מספרה,"2020-07-27 - תל אביב - יפו, נווה שאנן",2020-07-27,32.05783,34.78042,32.05783/34.78042,"35, נווה שאנן, תל אביב - יפו, נווה שאנן, תל אביב-יפו, מחוז תל אביב, ישראל",Yael Netzer,
20200727_192602.jpg,לכל הלקוחות ההנחיות של משרד הבריאות הם: חובה לבישת מסכה. שמירת מרחק של 2 מטר. כניסה של 2  מטופלות אין להוריד מסכה בזמן הטיפול חובה לשטוף ידים במים וסבון או אלקו ג'ל בכניסה. אין להגיע לטיפול אם חום או שיעול יחד נשמור על בריאותנו בריאות לכולם צוות איריס נייל 3>,הנחיות של משרד הבריאות,הנחיות של משרד הבריאות,לכל הלקוחות,יחד נשמור על בריאותנו|בריאות לכולם|<חתימה>,,לב,Hebrew,hand written,cursive,paper|pen,מכון יופי,"2020-07-27 - תל אביב - יפו, נווה שאנן",2020-07-27,32.05656,34.78123,32.05656/34.78123,"62, יסוד המעלה, תל אביב - יפו, נווה שאנן, תל אביב-יפו, מחוז תל אביב, ישראל",Yael Netzer,
20200727_192808.jpg,"הכניסה למשרד עם חבישת מסכה בלבד, אין להוריד את המסכה כאשר נמצאים במשרד, נדרש להמתין למדידת חום בכניסה למשרד. | The entrance to the office, only with wearing mask, Please don't remove the mask When you are in the office. Please, Wait for heat measurement at the entrance.",,,,,משרד|office,,Hebrew|English,printed,square,paper|printer,"נדל""ן","2020-07-27 - תל אביב - יפו, נווה שאנן",2020-07-27,32.05737,34.78131,32.05737/34.78131,"46, יסוד המעלה, תל אביב - יפו, נווה שאנן, תל אביב-יפו, מחוז תל אביב, ישראל",Yael Netzer,
20200727_192820.jpg,NO MASK NO ENTRY,,,,,,,English,hand written,square,paper|marker pen,מכולת,"2020-07-27 - תל אביב - יפו, נווה שאנן",2020-07-27,32.05734,34.78127,32.05734/34.78127,"48, יסוד המעלה, תל אביב - יפו, נווה שאנן, תל אביב-יפו, מחוז תל אביב, ישראל",Yael Netzer,
20200727_192846.jpg,NO Mask No ENTRY | 4 person only !!!,,,,,,,English,hand written,square|cursive,paper|marker pen,מכולת,"2020-07-27 - תל אביב - יפו, נווה שאנן",2020-07-27,32.05734,34.78127,32.05734/34.78127,"48, יסוד המעלה, תל אביב - יפו, נווה שאנן, תל אביב-יפו, מחוז תל אביב, ישראל",Yael Netzer,
20200727_193045.jpg,על פי הנחיית התו הסגול חובה לבישת מסיכה בכניסה לעסק זה,הנחיית התו הסגול,הנחיות התו הסגול,,,עסק,,Hebrew,printed,square,paper|printer,מכון יופי,"2020-07-27 - תל אביב - יפו, נווה שאנן",2020-07-27,32.0581,34.78075,32.0581/34.78075,"8, ראש פינה, תל אביב - יפו, נווה שאנן, תל אביב-יפו, מחוז תל אביב, ישראל",Yael Netzer,
20200727_193121.jpg,אסור להכנס לחנות בלי מסכה _________ NO mask no ENTER _________ <אמהרית>,,,,,חנות,,Hebrew|English|Amharic,hand written,cursive,green paper|marker pen,מכשירי חשמל,"2020-07-27 - תל אביב - יפו, נווה שאנן",2020-07-27,32.05804,34.78057,32.05804/34.78057,"7, ראש פינה, תל אביב - יפו, נווה שאנן, תל אביב-יפו, מחוז תל אביב, ישראל",Yael Netzer,
20200727_193745.jpg,DEAR CUSTOMER <אמהרית> * Please fiollow the health and safety regulations. * Wear mask all the times. * Keep 2 meters apart. * Please wait for the customer inside  to leave and only then enter.,health and safety regulations,health and safety regulations,DEAR CUSTOMER,,,מסכה,English|Amharic,printed,square,paper|printer,סדקית,"2020-07-27 - תל אביב - יפו, נווה שאנן",2020-07-27,32.05928,34.77879,32.05928/34.77879,"10, נווה שאנן, תל אביב - יפו, נווה שאנן, תל אביב-יפו, מחוז תל אביב, ישראל",Yael Netzer,
20200728_163349.jpg,"* הצהרת בריאות ומדידת חום לנכנסים *רישום  ותיעוד פרטי לקוחות * סימון מרחק של 2 מטרים בין הלקוחות בקופה * מחיצה פיסית בין המוכר לקונה * בחנות שגודלה עד 100 מ""ר יוכלו לשהות 2  לקוחות לכל קופה רושמת פעילה.   SKECHERS | ""התו הסגול למסחר"" - רגולציה עצמית  מדידת חום  מגבלת לקוחות שילוט עם  הנחיות היגיינה (חיטוי) רישום ותיעוד  (כולל פרטי  לקוחות)",התו הסגול למסחר|רגולציה עצמית,התו הסגול למסחר|רגולציה עצמית,,,,מדידת חום|אישה|תמרור אזהרה|חמרי ניקוי|דף ועט,Hebrew,printed,square,print,"נעליים, ספורט","2020-07-28 - שדרות דוד טוביהו, שכונה ט",2020-07-28,31.25011,34.77292,31.25011/34.77292,"גרנד קניון באר שבע, 125, שדרות דוד טוביהו, שכונה ט, באר שבע, ישראל",Yael Netzer,
20200728_163355.jpg,לקוחות יקרים חובה לשים מסכות  על האף והפה כשנכנסים לסקצ'רס. תודה.,,,לקוחות יקרים,תודה,סקצ'רס,,Hebrew,printed,square,paper|printer,"נעליים, ספורט","2020-07-28 - שדרות דוד טוביהו, שכונה ט",2020-07-28,31.25011,34.77292,31.25011/34.77292,"גרנד קניון באר שבע, 125, שדרות דוד טוביהו, שכונה ט, באר שבע, ישראל",Yael Netzer,
20200728_163509.jpg,חובה שמירת מרחק 2 מטר. עטיית מסכה על האף והפה לכל אורך השהייה בסניף. לא תתאפשר כניסה לסניף ללא מסכה וחיטוי ידיים,,,,,סניף,,Hebrew,printed,square,paper|printer,סלולר,"2020-07-28 - שדרות דוד טוביהו, שכונה ט",2020-07-28,31.24986,34.77262,31.24986/34.77262,"גרנד קניון באר שבע, 125, שדרות דוד טוביהו, שכונה ט, באר שבע, ישראל",Yael Netzer,
